{
  "$schema": "https://json-schema.org/draft/2020-12/schema",
  "type": "array",
  "items": {
    "type": "object",
    "additionalProperties": false,
    "required": ["universityId", "directoryCategory", "expectedState", "reviewStatus", "reviewDate", "finding"],
    "properties": {
      "universityId": { "type": "string", "minLength": 1, "pattern": "^[a-z0-9-]+$" },
      "directoryCategory": { "enum": ["qs-directory", "specialist"] },
      "expectedState": { "enum": ["official-list", "china-requirements", "faculty-only", "not-public", "pending"] },
      "reviewStatus": { "enum": ["unreviewed", "reviewed", "blocked"] },
      "reviewDate": { "type": "string", "pattern": "^\\d{4}-\\d{2}-\\d{2}$" },
      "finding": { "type": "string", "minLength": 1, "pattern": "\\S" }
    }
  }
}
