[
  {
    "universityId": "imperial-college-london",
    "directoryCategory": "qs-directory",
    "expectedState": "china-requirements",
    "reviewDate": "2026-08-02",
    "finding": "China undergraduate institution background affects the published postgraduate requirements; no complete public university roster was found.",
    "reviewStatus": "reviewed"
  },
  {
    "universityId": "university-of-oxford",
    "directoryCategory": "qs-directory",
    "expectedState": "china-requirements",
    "reviewDate": "2026-08-02",
    "finding": "China-specific entry requirements distinguish undergraduate institution background, but no complete public university roster was found.",
    "reviewStatus": "reviewed"
  },
  {
    "universityId": "university-of-cambridge",
    "directoryCategory": "qs-directory",
    "expectedState": "official-list",
    "reviewDate": "2026-08-02",
    "finding": "The university publishes Group A and Group B Chinese university lists with corresponding grade thresholds.",
    "reviewStatus": "reviewed"
  },
  {
    "universityId": "university-college-london",
    "directoryCategory": "qs-directory",
    "expectedState": "official-list",
    "reviewDate": "2026-08-02",
    "finding": "The university publishes Chinese institution bands that affect grade thresholds; an unlisted recognised institution may still apply under the higher threshold.",
    "reviewStatus": "reviewed"
  },
  {
    "universityId": "university-of-edinburgh",
    "directoryCategory": "qs-directory",
    "expectedState": "official-list",
    "reviewDate": "2026-08-02",
    "finding": "The university publishes a Priority List and course bands that jointly determine requirements.",
    "reviewStatus": "reviewed"
  },
  {
    "universityId": "kings-college-london",
    "directoryCategory": "qs-directory",
    "expectedState": "china-requirements",
    "reviewDate": "2026-08-02",
    "finding": "China undergraduate institution background affects requirements, but no complete public university roster was found.",
    "reviewStatus": "reviewed"
  },
  {
    "universityId": "university-of-manchester",
    "directoryCategory": "qs-directory",
    "expectedState": "china-requirements",
    "reviewDate": "2026-08-02",
    "finding": "University, computer-science, and law pages say undergraduate institution quality affects requirements; no current complete public roster was found.",
    "reviewStatus": "reviewed"
  },
  {
    "universityId": "university-of-bristol",
    "directoryCategory": "qs-directory",
    "expectedState": "official-list",
    "reviewDate": "2026-08-02",
    "finding": "The university publishes accepted Chinese universities, with course restrictions that remain applicable.",
    "reviewStatus": "reviewed"
  },
  {
    "universityId": "london-school-of-economics-and-political-science",
    "directoryCategory": "qs-directory",
    "expectedState": "china-requirements",
    "reviewDate": "2026-08-02",
    "finding": "China undergraduate institution background affects requirements, but no complete public university roster was found.",
    "reviewStatus": "reviewed"
  },
  {
    "universityId": "university-of-warwick",
    "directoryCategory": "qs-directory",
    "expectedState": "official-list",
    "reviewDate": "2026-08-02",
    "finding": "The university states that it considers only universities on its published list, with course-specific requirements.",
    "reviewStatus": "reviewed"
  },
  {
    "universityId": "university-of-birmingham",
    "directoryCategory": "qs-directory",
    "expectedState": "china-requirements",
    "reviewDate": "2026-08-02",
    "finding": "China requirements use institution-sensitive groupings, but no complete public university roster was found.",
    "reviewStatus": "reviewed"
  },
  {
    "universityId": "university-of-leeds",
    "directoryCategory": "qs-directory",
    "expectedState": "china-requirements",
    "reviewDate": "2026-08-02",
    "finding": "The university says schools use different institution standards; no current university-wide complete roster was found.",
    "reviewStatus": "reviewed"
  },
  {
    "universityId": "university-of-glasgow",
    "directoryCategory": "qs-directory",
    "expectedState": "official-list",
    "reviewDate": "2026-08-02",
    "finding": "The university publishes a Chinese university PDF specifying eligible institutions and grade requirements.",
    "reviewStatus": "reviewed"
  },
  {
    "universityId": "university-of-sheffield",
    "directoryCategory": "qs-directory",
    "expectedState": "official-list",
    "reviewDate": "2026-08-02",
    "finding": "The university publishes a bilingual Chinese institution lookup table with 2:1 and 2:2 grade thresholds.",
    "reviewStatus": "reviewed"
  },
  {
    "universityId": "durham-university",
    "directoryCategory": "qs-directory",
    "expectedState": "not-public",
    "reviewDate": "2026-08-02",
    "finding": "No current complete public Chinese university list or explicit institution-tier table was found in this review.",
    "reviewStatus": "reviewed"
  },
  {
    "universityId": "university-of-nottingham",
    "directoryCategory": "qs-directory",
    "expectedState": "official-list",
    "reviewDate": "2026-08-02",
    "finding": "The university publishes bilingual Tier 1 and Tier 2 institution lists; the law school has separate requirements.",
    "reviewStatus": "reviewed"
  },
  {
    "universityId": "queen-mary-university-of-london",
    "directoryCategory": "qs-directory",
    "expectedState": "china-requirements",
    "reviewDate": "2026-08-02",
    "finding": "China undergraduate institution background affects requirements, but no complete public university roster was found.",
    "reviewStatus": "reviewed"
  },
  {
    "universityId": "university-of-southampton",
    "directoryCategory": "qs-directory",
    "expectedState": "official-list",
    "reviewDate": "2026-08-02",
    "finding": "The university publishes a tier list that determines the corresponding grade threshold.",
    "reviewStatus": "reviewed"
  },
  {
    "universityId": "university-of-st-andrews",
    "directoryCategory": "qs-directory",
    "expectedState": "china-requirements",
    "reviewDate": "2026-08-02",
    "finding": "China undergraduate institution background affects requirements, but no complete public university roster was found.",
    "reviewStatus": "reviewed"
  },
  {
    "universityId": "university-of-bath",
    "directoryCategory": "qs-directory",
    "expectedState": "not-public",
    "reviewDate": "2026-08-02",
    "finding": "No current complete public Chinese university list was found; programme requirements remain on their course pages.",
    "reviewStatus": "reviewed"
  },
  {
    "universityId": "university-of-exeter",
    "directoryCategory": "qs-directory",
    "expectedState": "not-public",
    "reviewDate": "2026-08-02",
    "finding": "The current 2026 rule removed the old institution-ranking requirement, accepts all Chinese Ministry of Education recognised bachelor's institutions, and uses uniform grade thresholds.",
    "reviewStatus": "reviewed"
  },
  {
    "universityId": "university-of-liverpool",
    "directoryCategory": "qs-directory",
    "expectedState": "china-requirements",
    "reviewDate": "2026-08-02",
    "finding": "China undergraduate institution background affects requirements, but no complete public university roster was found.",
    "reviewStatus": "reviewed"
  },
  {
    "universityId": "newcastle-university",
    "directoryCategory": "qs-directory",
    "expectedState": "china-requirements",
    "reviewDate": "2026-08-02",
    "finding": "China undergraduate institution background affects requirements, but no complete public university roster was found.",
    "reviewStatus": "reviewed"
  },
  {
    "universityId": "university-of-york",
    "directoryCategory": "qs-directory",
    "expectedState": "china-requirements",
    "reviewDate": "2026-08-02",
    "finding": "China undergraduate institution background affects requirements, but no complete public university roster was found.",
    "reviewStatus": "reviewed"
  },
  {
    "universityId": "lancaster-university",
    "directoryCategory": "qs-directory",
    "expectedState": "china-requirements",
    "reviewDate": "2026-08-02",
    "finding": "China undergraduate institution background affects requirements, but no complete public university roster was found.",
    "reviewStatus": "reviewed"
  },
  {
    "universityId": "queens-university-belfast",
    "directoryCategory": "qs-directory",
    "expectedState": "china-requirements",
    "reviewDate": "2026-08-02",
    "finding": "China undergraduate institution background affects requirements, but no complete public university roster was found.",
    "reviewStatus": "reviewed"
  },
  {
    "universityId": "cardiff-university",
    "directoryCategory": "qs-directory",
    "expectedState": "china-requirements",
    "reviewDate": "2026-08-02",
    "finding": "China undergraduate institution background affects requirements, but no complete public university roster was found.",
    "reviewStatus": "reviewed"
  },
  {
    "universityId": "university-of-reading",
    "directoryCategory": "qs-directory",
    "expectedState": "china-requirements",
    "reviewDate": "2026-08-02",
    "finding": "China undergraduate institution background affects requirements, but no complete public university roster was found.",
    "reviewStatus": "reviewed"
  },
  {
    "universityId": "london-business-school",
    "directoryCategory": "specialist",
    "expectedState": "not-public",
    "reviewDate": "2026-08-02",
    "finding": "No public Chinese undergraduate institution list was found; the reviewed evidence is the Masters in Management application requirements.",
    "reviewStatus": "reviewed"
  },
  {
    "universityId": "loughborough-university",
    "directoryCategory": "qs-directory",
    "expectedState": "official-list",
    "reviewDate": "2026-08-09",